title,content,date,time,Şimdi,Açılış,Yüksek,Fark %
4 aracı kurumdan 21 hisse önerisi,"Analistler, önümüzdeki günlerde borsanın 110.000 seviyesinin üstünü görmesini bekliyor. Hisse seçimde dikkatli olmak kaydıyla, olası düşüşlerde alım yapılabileceğini söylüyor.",24.07.2017,12:24,"8,55","8,59","8,64","-0,23%"
Bankalar faizden çok 'sürüm'den kazandı!,"Bankacılık sektörü yılın ilk beş ayında 21.2 milyar TL net kâr elde etti, özkaynak kârlılığında yüzde 14.7’lik artış yakaladı. Haziran kârı ise 1 milyar daha az gelecek.",24.07.2017,08:40,"8,55","8,59","8,64","-0,23%"
Vakıfbank’a yeni kurumsal iletişimci,Vakıfbank Kurumsal İletişim Grubu’na yeni bir isim dahil oldu,21.07.2017,16:46,"8,57","8,57","8,58","-0,35%"
Yılın en büyük satın almasında Akbank'ın rolü,Petrol Ofisi’nin satın alma finansmanını Akbank ve ING Bank koordine etti,18.07.2017,15:36,"8,54","8,64","8,66","-1,27%"
Haftanın kazandıranı borsa oldu,"Borsa bu hafta yatırımcısına kazandırırken, döviz ve altın kaybettirdi",15.07.2017,11:17,,,,
Akbank üst yönetiminde değişiklik,Muharras Üye Cem Mengi ile yollar ayrıldı. Mengi’nin yerine Ahmet Fuat Ayla getirildi.,12.07.2017,14:29,"8,54","8,37","8,57","1,30%"
Binbaşgil: Mevduat faizlerinde kısmi gerileme olabilir,"Akbank Genel Müdürü Binbaşgil, Euromoney'in ödül töreninin ardından Türkiye ekonomisi hakkında açıklamalarda bulundu",10.07.2017,05:26,"8,15","8,16","8,19","0,49%"
Banka raporu 2017,"250 milyar lira limitiyle devreye giren Kredi Garanti Fonu teşviği, bankaların karlılık ve kredi hacimlerinde uzun zamandır özledikleri büyüme rakamlarına ulaşmasına yardımcı oldu. ",06.07.2017,13:07,"8,17","8,13","8,17","0,74%"
Türkiye’de uluslararası bankacılığın en iyisi Akbank,"Akbank, EMEA Finance’in “2016 Yılı Başarı Ödülleri”nde 4 birincilik kazanarak Yurtdışı Borçlanma İşlemlerinde En Başarılı Banka seçildi",05.07.2017,11:53,"8,11","8,22","8,22","-1,34%"
"Akbank, 200 milyon euro finansman sağladı","Akbank, Avrupa Yatırım Bankası'ndan 200 milyon euro finansman sağladı. Banka söz konusu tutarı iç finansmanda kullanılacak.",03.07.2017,09:48,"8,08","8,08","8,17","0,25%"
Blockchain teknolojisi  Türkiye’de ilk kez Akbank’ta ,"Akbank, uluslararası para transferinde blockchain teknolojisini kullanarak şeffaflık ve hızı artırıp, maliyetleri düşüren çözümler sunan teknoloji firması Ripple ile anlaşan ilk Türk Bankası oldu.",29.06.2017,14:40,"8,13","8,24","8,29","-0,97%"
İstanbul metrosunda ATM'ler geri döndü,İstanbul’un Anadolu ve Avrupa Yakası'ndaki metro istasyonlarında bulunan banka ATM'leri ocak ayında kaldırılmıştı. ATM'ler geçtiğimiz haftadan itibaren aktif hale getirilmeye başladı.,24.06.2017,09:32,,,,
Axess’ten e-ticaret kampanyaları,"Akbank’ın her zaman kazandıran kredi kartı Axess, Temmuz ayında internet üzerinden alışveriş yapanlara, yüzlerce liralık chip-para hediye kazanma fırsatı sunuyor.",23.06.2017,17:54,"8,18","8,28","8,28","-1,09%"
Piyasalar istikrara kavuştu,"Referandum sonrası piyasalarda dengelenme yaşandı, borsa yükseldi, turizm ve sıcak para girişi oldu",20.06.2017,09:05,"8,20","8,25","8,27","-0,36%"
Akbank ve Google Premier Partners'tan işbirliği,"Akbank, KOBİ’lerin büyümelerini desteklemek ve onlara yeni iş fırsatları yaratmak amacıyla, Google Premier Partners ile birlikte KOBİ’lerin dijitalleşme sürecini hızlandırmayı amaçlayan bir kampanya başlattı.",15.06.2017,13:52,"8,03","8,08","8,08","-0,99%"
Akbank takipteki alacaklarını sattı,Akbank takipteki kredi alacaklarını 39 milyon TL karşılığında sattı,14.06.2017,14:11,"8,11","8,07","8,11","0,62%"
İşte Türkiye'nin en değerli markası,"Brand Finance tarafından ""Türkiye'nin En Değerli Markaları-Turkey 100"" çalışmasının 10'uncusu tamamlandı.",14.06.2017,13:18,"8,11","8,07","8,11","0,62%"
İşte Türkiye'nin en 'süper markaları',"Superbrands, Süpermarkalar Türkiye 2016 çalışmasının sonuçlarını açıkladı
",09.06.2017,13:40,"7,90","7,87","7,95","1,02%"
"Fitch, 4 Türk bankasının notunu teyit etti","Fitch, Akbank, İş Bankası, Garanti ve Yapı Kredi'nin kredi notlarını teyit etti",08.06.2017,19:57,"7,82","7,87","7,88","-0,51%"
Akbank'tan iki bayram arası ödemesi olmayan kredi,"Müşterilerinin ihtiyaçlarına göre farklı ürün ve hizmetler geliştiren Akbank, bayram için özel bir kredi fırsatı sunuyor. ",08.06.2017,18:12,"7,82","7,87","7,88","-0,51%"
Vakıfbank ve Halkbank 42 bin işletmeye kredi verdi,"Bilim Sanayi ve Teknoloji Bakanı Özlü, 2017 Yılı KOSGEB Sıfır Faizli İşletme Kredi Faiz Desteği Programı kapsamında Vakıfbank ve Halkbank'ın 42 bin işletmeye kredi kullandırdığını açıkladı",07.06.2017,13:15,"7,86","7,91","7,96","-0,76%"
Krediler Facebook'tan,"48 milyonu aşan sosyal medya kullanıcı bankaları harekete geçirdi. Bazı bankalar para transferi, kredi başvurusu ve müşteri şikayetlerini artık Facebook, Twitter üzerinden de alıyor. Bu kanalları kullananlar daha düşük faizli kredi ile ödüllendiriliyor…",05.06.2017,11:44,"7,90","7,98","8,00","-0,63%"
Hrant Dink cinayetinde davaları birleştirme kararı,"Hrant Dink cinayeti soruşturması sonucunda, Fetullah Gülen, eski savcı Zekeriya Öz'ün de aralarında bulunduğu 50 sanık hakkında açılan yeni dava, aralarında Ogün Samast, Erhan Tuncel'in de bulunduğu 35 sanıklı ana dava ile birleştirilecek",02.06.2017,21:31,"7,95","7,93","7,95","1,40%"
MB: KGF büyümesi dengelenecek,Merkez Bankası'nın Finansal İstikrar Raporu'nda KGF kapsamındaki kredilerdeki büyümenin önümüzdeki dönemde dengeleneceği vurgusu yapıldı,31.05.2017,06:39,"7,84","7,84","7,96","0,38%"
‘Türk Bankacılar Gecesi’nde buluştular,"Almanya'da faaliyet gösteren bankaların düzenlediği Türk Bankacılar Gecesi, Türk ve Alman bankacıları buluşturdu.",27.05.2017,11:55,,,,
İşte %100 hedefi vuran  CEO ve  YKB'ler,The Brand Age dergisi yaptığı çalışmalarla dikkat çeken ve kendi sektörüne damga vuran 15 iş insanını açıkladı.,24.05.2017,15:23,"7,96","7,85","8,12","1,79%"
Murat Sarı’ya ING’de önemli görev,"Küresel banka devi ING’de, tüm bireysel kredilerden sorumlu mevkiye bir Türk getirildi. ING Bank GMY Murat Sarı terfi ederek Amsterdam’da görevlendirildi.",22.05.2017,11:50,"7,69","7,69","7,71","1,05%"
ATM'ler metrolara geri döndü,Ocak ayında İstanbul’un Anadolu ve Avrupa Yakası'ndaki metro istasyonlarında kaldırılan bazı ATM'ler yeni düzeniyle istasyonlardaki yerlerini aldı.,19.05.2017,10:43,,,,
Borsadaki bankaların kar artışı yüzde 70'e yaklaştı,Borsada işlem gören 10 mevduat bankasının net karı bu yılın ilk 3 ayında 2016'nın aynı dönemine göre yüzde 68 artarak 9 milyar 43 milyon lira oldu,15.05.2017,11:56,"7,59","7,61","7,63","0,40%"
Sabancı Holding satışlarını yüzde 9.5 artırdı,"Sabancı Holding CEO'su Mehmet Göçmen, Sabancı Holding'in bugüne kadar olduğu gibi bundan sonra da ülke için çalışmaya devam edeceğini söyledi",10.05.2017,16:08,"7,76","7,69","7,76","0,65%"
Türk bankalarının eurobond ihraçlarına güçlü talep,"Türkiye'nin en büyük 5 bankası, 2017'nin 4 ayında yaklaşık 3 milyar dolar tutarında eurobond ihracı gerçekleştirdi",09.05.2017,11:54,"7,71","7,60","7,71","1,45%"
Bankalarda kâr sezonu,"Bankalar 2017 yılına hızlı girdi, ilk çeyrekte kâr artışlarının yüzde 34 civarında olması bekleniyor. Borsada bankalara yönelik ilgi artıyor.",02.05.2017,15:25,"7,76","7,86","7,90","-0,77%"
O hisse yüzde 40 yükseldi,Borsa İstanbul'daki yükselişe banka hisseleri öncülük ediyor. En çok yükselenler ise...,30.04.2017,10:24,,,,
2017 yılının en güçlü 50 iş kadını,"Fortune Türkiye'nin hazıladığı listede, şirketin büyüklüğü ve global ekonomideki önemi, kurumun performansı ve yönü, yöneticinin kariyer çizgisinde nasıl ilerlediği ve sosyal-kültürel kalkınmaya etkisi temel kriterler olarak belirlendi. İşte Türkiye'nin en güçlü 50 iş kadını.",28.04.2017,12:53,"7,82","7,79","7,85","0,77%"
Akbank'tan 1.4 milyar TL kâr,"2017’nin ilk çeyreğinde 230 milyar TL kredi hacmine ulaşan Akbank, yılın ilk üç ayında 1 milyar 452 milyon TL konsolide net kâr elde etti.",25.04.2017,18:15,"7,98","7,94","8,04","1,01%"
6 Türk bankası için yüzde 46 büyüme beklentisi,"Deutsche Bank, Türk bankalarının karlarında yüzde 46 büyüme bekliyor",18.04.2017,16:31,"7,62","7,45","8,22","1,87%"
Akbank hissesinde üçgen atıldı,Akbank hisse senedinde gelen hızlı alımla ani yükseliş yaşandı.Yüzde 10 yukarda olan hissede devre kesici işlem uygulandı,18.04.2017,16:19,"7,62","7,45","8,22","1,87%"
Bankacılık hisseleri için olumlu görünüm ,"Credit Suisse, bankacılık sektöründe istikrarlı bir görünüm bekliyor",18.04.2017,09:15,"7,62","7,45","8,22","1,87%"
Hangi banka kaç stajyer alacak?,Bankacılık sektörü yaz dönemi staj başvurularını kabul etmeye başladı.,17.04.2017,14:10,"7,48","7,54","7,57","0,00%"
‘Finansın Sultanı’ Şeniz Yarcan neler yapıyor?,"Sermaye Piyasalarının usta ismi Şeniz Yarcan 4 ay önce emekli  oldu. O günden beri hiç ses seda çıkmadı. Merak ettim, aradım, buldum. Bomba gibi bir ‘iş kadını’yla konuştum...",14.04.2017,09:08,"7,48","7,36","7,51","1,63%"
Y kuşağı bir bankadan ne bekler?,"Akbank Düşünce Kulübü üyelerinin ""Y kuşağı bir bankadan ne bekler?” temasından yola çıkarak şekillendirdikleri projeleri, alanlarında uzman jüri üyeleri tarafından değerlendirildi.",11.04.2017,15:10,"7,43","7,46","7,56","-0,40%"
Sakıp Sabancı mezarında anıldı,"Merhum işadamı Sakıp Sabancı, mezarı başında sevenlerinin katılımıyla anıldı",10.04.2017,12:46,"7,46","7,07","7,48","5,97%"
LYS sınav ücretleri açıklandı,2017 LYS sınav giriş ücretleri açıklandı,05.04.2017,10:19,"7,11","7,02","7,12","1,28%"
Biz kredi verme gayreti içindeyiz,"Türkiye Bankalar Birliği (TBB) Yönetim Kurulu Başkanı Hüseyin Aydın, ""Sicil afından dolayı bir kişinin krediye erişememesi söz konusu değil"" dedi",04.04.2017,16:53,"7,02","6,95","7,06","0,72%"
Meriç Uluşahin Pasha Bank yönetiminde,Pasha Bank'ın yönetimine Farid Mammadov Yönetim Kurulu Üyesi ve Meriç Uluşahin Bağımsız Yönetim Kurulu Üyesi olarak seçildi,04.04.2017,15:13,"7,02","6,95","7,06","0,72%"
Mavi ışıklar 'otizm' için yandı,"Otizme dikkati çekmek amacıyla 15 Temmuz Şehitler Köprüsü, Fatih Sultan Mehmet Köprüsü ve Galata Kulesi gibi İstanbul'un birçok simge yapısı, mavi ışıkla aydınlatıldı",02.04.2017,23:23,,,,
KOSGEB’in faiz destekli kredisine iştah güçlü,"Bankaların KOSGEB’in faiz desteği sağladığı kredilere ilgisi yüksek. Son 15 günde, 60 bini aşkın dosyaya işlem yapıldı",29.03.2017,11:40,"7,04","7,00","7,05","-0,85%"
Akbank'ta 'sıkıntı' sona erdi,"Akbank'ta bugün teknik sebeplerle banka içi sistemlerde kesintiler yaşandı. Birçok işlem yapılamazken, öğleden sonra sıkıntı giderildi.",27.03.2017,15:49,"7,06","7,09","7,11","-0,84%"
2016 bankacılar için çok iyi geçti,2016'da bankaların gelir ve kârı arttı. Bankalar kadar banka yöneticileri de kazandı. Genel müdür ve müdür yardımcıları ve diğer kilit yöneticilerden oluşan üst yönetimler geçen yıl yarım milyar liralık kazanç sağladı,27.03.2017,05:22,"7,06","7,09","7,11","-0,84%"
"Borsa kaybettirdi, altın ve döviz kazandırdı","Bu hafta borsa yatırımcısına kaybettirirken, altın ve döviz kazandırdı",25.03.2017,12:17,,,,
Intesa Sanpaolo Türkiye’ye Türk Genel Müdür,"Ünlü İtalyan bankacılık grubu içinde kurumsal bankacılık alanında görev yapan Ufuk Cemal Bali, Intesa Sanpaolo Türkiye’nin Genel Müdürlüğüne atandı",22.03.2017,18:47,"7,04","7,05","7,09","-0,85%"
Akbank'ın sendikasyonuna rekor talep,"Akbank’ın 1,2 milyar ABD Doları tutarındaki sendikasyon kredisine yüzde 100’ün üzerinde talep geldi; kreditörlere sekiz yeni banka katıldı.",22.03.2017,12:34,"7,04","7,05","7,09","-0,85%"
Bankalar metroda ATM'ler için yarıştı,Bankalar son olarak İstanbul’un Anadolu ve Avrupa Yakası'ndaki metro istasyonlarındaki ATM’ler için yarıştı.,21.03.2017,09:04,"7,10","7,20","7,24","-0,98%"
Moody's 17 Türk bankasını değerlendirdi,"Moody's, 14 Türk bankasının uzun vadeli borç ve mevduat notlarını değiştirmeksizin not görünümlerini negatife çekti",20.03.2017,22:53,"7,17","7,10","7,17","0,42%"
Dünyanın en değerli bankaları,"Marka değerlendirme kuruluşu Brand Finance'ın gerçekleştirdiği ""Dünyanın En Değerli 500 Banka Markası-2017"" araştırması yayınlandı. İşte marka gücü, şirketin finansal performansı, sektörün gelişimi ve ekonomik görünümle ilgili çok sayıda kritere dayanan araştırmada yer alan 100 banka...",19.03.2017,13:02,,,,
Emekliye hangi banka ne kadar promosyon ödeyecek,"Emekliye promosyon ödemeleri hangi bankada ne zaman ödenecek? İşte,merak edilen o detaylar",16.03.2017,16:24,"7,15","7,17","7,24","0,99%"
"Türkiye’de ""Yılın Borçlanma İşlemi Ödülü"" Akbank’ın ","Global Capital’in Londra'da gerçekleştirdiği ödül töreninde Akbank, Yılın Borçlanma İşlemi Ödülü'ne layık görüldü",15.03.2017,12:35,"7,08","7,05","7,12","0,85%"
Borsada bu şirketler kazandıracak,Borsa İstanbul’da referanduma doğru geri çekilmeler yaşansa da 2017’de olası yeni zirveler şaşırtmamalı. BIST 100 Endeksi’nde gerçekleşecek güçlü yükselişte piyasa değeri büyük şirketler bu yıl öne çıkacak,12.03.2017,08:07,,,,
Piyasalarda dolar ve euronun haftası oldu,"Bu hafta dolar ve euro yatırımcısına kazandırırken, altın ve borsa kaybettirdi. Borsa İstanbul'da işlem gören hisse senetleri haftayı yüzde 0,12'lik düşüşle tamamladı.",11.03.2017,13:54,,,,
Akbank'ın tahvil ihracına 2 milyar dolardan fazla talep,Akbank'ın Basel 3 uyumlu ilk tahvil ihracı gerçekleşti ve 2 milyar dolardan fazla talep geldi,09.03.2017,14:50,"7,04","7,13","7,13","-1,68%"
Milyarder Türklerin veliahtları,Bazıları henüz 3 yaşında bile değil ama Türkiye ekonomisinin geleceği bu çocuklara bağlı...,07.03.2017,17:09,"7,32","7,45","7,47","-1,35%"
Bankacılıkta yeni nesil şube dönemi,"Bankacılık sektöründe şubelerin işlem adedinden aldığı payın azalmasıyla beraber, şubelerin tasarımları da değişiyor...",07.03.2017,13:36,"7,32","7,45","7,47","-1,35%"
İşte faizsiz krediyle ilgili merak edilen herşey,"KOSGEB'in 50 bin TL’lik sıfır faizli kredi desteğinin dağıtımı başladı. 460 bin 167 işletmeye üç yıl vadeli, faizsiz kredi verilecek. Kredi limitleri 20 bin ile 50 bin TL arasında değişecek...",06.03.2017,17:14,"7,42","7,24","7,46","3,06%"
Akbank ve Paraşüt KOBİ’leri dijitale taşıyor,"KOBİ’lerin hayatlarını kolaylaştırmak için yenilikçi ürün ve uygulamalar sunan Akbank, Paraşüt ile yaptığı işbirliğiyle işletmelerin finansal operasyonlarını tek elden yöneterek kontrol altına alabilmelerini sağlıyor",06.03.2017,16:18,"7,42","7,24","7,46","3,06%"
Fitch'ten Akbank yorumu,"Fitch, Akbank'ın Basel III uyumlu tahvillerine ön not olarak BB verdi",06.03.2017,12:13,"7,42","7,24","7,46","3,06%"
Akbank tahvil ihracına hazırlanıyor,"Akbank, eurobond ihracı için Goldman Sachs'ın da bulunduğu 6 bankayı yetkilendirdi",06.03.2017,12:06,"7,42","7,24","7,46","3,06%"
Akbank'tan 1 milyar euroluk ihraç başvurusu,Akbank 1 milyar euro bedelli İpotek Teminatlı Menkul Kıymet ihracı için Sermaye Piyasası Kurulu'na başvurdu,03.03.2017,16:38,"7,20","7,21","7,26","-0,28%"
Özel sektörün vergi şampiyonu Akbank ,"Akbank 2016 yılında tahakkuk eden Kurumlar Vergisi’nde 'özel sektör vergi şampiyonu' oldu
",03.03.2017,16:02,"7,20","7,21","7,26","-0,28%"
Bankaların kar artışı 2016'da yüzde 50'ye yaklaştı,Borsa İstanbul'da işlem gören bankaların karlarındaki artış yüzde 47.3'ü seviyesinde yükseldi,03.03.2017,11:15,"7,20","7,21","7,26","-0,28%"
Dev kampanyada 1 aylık ciro 2.6 milyar TL,"Emlak Konut GYO öncülüğünde başlayan kampanya seferberliği konut alıcısını harekete geçirdi. 1 ayda 2 bin 300 ev satıldı, 2.6 milyar lira ciro sağlandı. Düşük faiz ve uzun vade fırsatları sunan kampanya 31 Mart’ta sona erecek",02.03.2017,04:22,"7,22","7,17","7,26","0,84%"
Akbank’tan KOSGEB işbirliğiyle sıfır faizli kredi,"Akbank, esnafın ve KOBİ’lerin rekabet gücünü artırmak ve büyümelerine destek olmak için “sıfır faizli, uygun geri ödemeli” kredi veriyor",28.02.2017,15:06,"6,96","7,00","7,02","-0,57%"
Yıldırım'dan KOSGEB kredisi hakkında flaş açıklama,"Başbakan Yıldırım, KOBİ'lere ödenecek 50 bin TL'lik faizsiz kredi desteğinin bugün ödenmeye başlayacağını söyledi",28.02.2017,12:38,"6,96","7,00","7,02","-0,57%"
Milyoner Türkler parayı gayrimenkule yatırıyor,"Akbank Genel Müdür Yardımcısı Levent Çelebioğlu özel bankacılık müşterisi Türklerin İtalya İspanya ve Almanya’da ofis, lojistik merkezi ve çeşitli gayrimenkul yatırımları yaptıklarını söyledi",28.02.2017,07:26,"6,96","7,00","7,02","-0,57%"
Akbank kâr payı dağıtacak,Akbank yüzde 22 kâr payı dağıtma kararı aldı.,27.02.2017,18:05,"7,00","7,04","7,08","-0,43%"
KOSGEB kredisi başvuru sonuçları bugün açıklanıyor,Geçtiğimiz hafta pazartesi günü son bulan KOSGEB kredisi başvuruları bugün hak kazananlara SMS olarak bildirilmeye başlanacak,27.02.2017,14:28,"7,00","7,04","7,08","-0,43%"
“Özel Bankacılık Ödülü” 10. kez Akbank Private Banking’in,"Yönettiği varlık hacmi 20 milyar lirayı aşan Akbank Private Banking, Euromoney’nin “Best Private Banking in Turkey"" (En İyi Özel Bankacılık)
ödülünü 10. kez aldı
",27.02.2017,11:47,"7,00","7,04","7,08","-0,43%"
"Sabancı çıktı, Koç girdi",Chatham House Türkiye destekçisi Koç Grubu oldu ve Ali Koç mütevelli heyetinde yer alacak,26.02.2017,07:44,,,,
Bu hafta yatırım araçları kazandırmadı,"Bu hafta tüm yatırım araçları yatırımcısına kaybettirirken, en büyük düşüş yüzde 2,48 ile euroda yaşandı",25.02.2017,13:37,,,,
Sabancı Holding finansal sonuçlarını açıkladı,"Zafer Kurtul: “Sabancı Holding 2017’de 4,5 milyar TL yatırım yapacak, çift haneli büyüyecek” ",24.02.2017,12:32,"7,03","7,08","7,12","-0,57%"
TÜYİD yeni Yönetim Kurulu’nu seçti,Yeni Yatırımcı İlişkileri Derneği’nin (TÜYİD) yeni dönem Yönetim Kurulu Başkanlığı görevine Nursel İlgen getirildi,21.02.2017,12:34,"7,18","7,17","7,26","0,28%"
Sabancı Holding'te Mehmet Göçmen dönemi,Sabancı Holding CEO'luğuna 30 Mart itibarıyla Mehmet Göçmen atandı.,20.02.2017,17:06,"7,16","7,28","7,29","-0,56%"
Bankalar 2016'da büyümeyi yakaladı,"Bankalar 2016'da aktif büyüklük, kredi ve mevduatta önemli büyüme oranları yakalarken, en büyük artış kârlılıkla görüldü.",20.02.2017,14:15,"7,16","7,28","7,29","-0,56%"
Akbank'tan toplu iş sözleşmesi açıklaması,Akbank arabulucu sürecinde gelinen noktayı KAP açıklamasıyla duyurdu,16.02.2017,16:12,"7,09","7,07","7,12","0,71%"
Dünyanın en değerli bankası ICBC oldu,"Brand Finance araştırmasına göre, dünyanın en değerli 500 banka markasının toplam değeri bu yıl 1 trilyon 74 milyar dolara ulaştı",09.02.2017,12:07,"7,11","7,07","7,14","0,71%"
10 soruda emekliye promosyon rehberi,Emekliler maaşlarını aldıkları bankalar ile anlaşarak promosyon alabilecekler,09.02.2017,07:18,"7,11","7,07","7,14","0,71%"
Doğuş Müşteri Sistemleri’ne n11.com’dan transfer,Doğuş Müşteri Sistemleri’nin pazarlama çalışmaları sorumlusu Bilgen Aldan oldu.,07.02.2017,15:50,"6,96","6,91","7,00","0,58%"
"5 günde 750 konut satıldı, ciro iki katına çıktı","240 ay vadeli kampanya, konuta doping oldu. 5 günde 605 milyon liralık 750 ev satıldı. Emlak Konut böylece 2016 ortalamasından 5.5 kat fazla performansa ulaştı",07.02.2017,07:08,"6,96","6,91","7,00","0,58%"
Emekli promosyonunda Akbank da protokolü imzaladı,Sosyal Güvenlik Kurumu’nun emeklilere promosyon ödenmesi çalışmasında Akbank da protokolü imzaladı,03.02.2017,16:34,"7,06","6,91","7,07","1,73%"
İşte dünyanın en değerli bankaları,"Marka değerlendirme kuruluşu Brand Finance'ın gerçekleştirdiği ""Dünyanın En Değerli 500 Banka Markası-2017"" araştırması yayınlandı. İşte marka gücü, şirketin finansal performansı, sektörün gelişimi ve ekonomik görünümle ilgili çok sayıda kritere dayanan araştırmada yer alan 100 banka...",03.02.2017,10:35,"7,06","6,91","7,07","1,73%"
18 Türk bankasının notu düştü,"Kredi derecelendirme kuruluşu Fitch, 18 Türk bankasının kredi notlarında düşüşe gitti",03.02.2017,06:41,"7,06","6,91","7,07","1,73%"
Akbank Türkiye'nin en değerli bankası,"Akbank, marka değerlendirme kuruluşu BrandFinance’in araştırmasında 6. kez üst üste ""Türkiye'nin En Değerli Banka Markası"" oldu.
",02.02.2017,14:37,"6,94","6,80","6,94","2,51%"
Akbank'tan KOBİ'lere teminat desteği,Akbank ve Kredi Garanti Fonu arasında imzalanan yeni protokol ile Hazine kaynaklı Portföy Garanti Sistemi'nin KOBİ’lerin hizmetine sunulduğu açıklandı,01.02.2017,14:12,"6,77","6,72","6,79","0,59%"
Aracı kurumlardan bankalar için hedef fiyat tavsiyesi,"Aracı kurumlar, Garanti Bankası ve Akbank için hedef fiyat tavsiyelerini güncelledi",01.02.2017,10:09,"6,77","6,72","6,79","0,59%"
Akbank'tan rekor kar rakamı,Akbank 2016 yılının 4. çeyreğinde 1 milyar 084 milyon TL  net kâr elde etti.,31.01.2017,18:25,"6,73","6,68","6,80","0,75%"
Bankaların bilançoları açıklanıyor! İşte tahminler,Merakla beklenen banka bilançoları bugün gelmeye başlıyor. İşte Foreks anketine göre 2016 yılının son çeyreğine ilişkin kâr tahminleri...,31.01.2017,17:05,"6,73","6,68","6,80","0,75%"
60 ay 0 faizli ev alma şansı,İkinci konut seferberliğinde 60 ay vadede faiz sıfıra çekildi. 240 ay vadede ise faiz oranı yüzde 0.73’e kadar inecek,29.01.2017,08:51,,,,
"Borsa ve döviz kazandırırken, altın kaybettirdi","Borsa İstanbul'da işlem gören hisse senetleri haftayı yüzde 0.92'lik yükselişle tamamlarken, külçe altının gram satış fiyatında yüzde 0.14'lük kayıp görüldü",28.01.2017,12:42,,,,
6 bankanın kârında yüzde 40 artış bekleniyor,Halka açık 6 büyük bankanın net kârının 2016'nın tamamında yüzde 40'ın üzerinde artması bekleniyor,27.01.2017,17:44,"6,35","6,41","6,46","-1,40%"
5 banka hissesi için tavsiye,Morgan Stanley 5 banka hissesi için hedef fiyat ve tavsiyede bulundu,27.01.2017,11:27,"6,35","6,41","6,46","-1,40%"
CaseCampus genç girişimcileri bekliyor,CaseCampus'a dördüncü dönemi için yeni başvurular başladı,26.01.2017,12:35,"6,44","6,32","6,44","2,22%"
Ezber bozan stratejilere odaklanmamız lâzım!,Bir süredir yoğun çalışma temposuna ara veren başarılı bankacı Önder Halisdemir Dünya'ya yakın dönem planlarını anlattı,20.01.2017,15:31,"6,35","6,25","6,37","1,93%"
'Yılın banka markası' ödülü Akbank'a,"The ONE Awards’da, Halk Jürisi’nin değerlendirmesi ile Akbank, “Bankacılık Sektörü Yılın En Başarılı Markaları” kategorisinde birinci oldu",20.01.2017,08:05,"6,35","6,25","6,37","1,93%"
Akbank’tan MTV’de alt limitsiz 4 taksit imkanı!,Akbank’ın MTV kampanyası ile motorlu taşıtlar vergisi ödemesini 1 – 31 Ocak 2017 tarihleri arasında Akbank kredi kartları ile yapanlar hem 4 taksit imkanından hem de avantajlardan faydalanıyorlar,18.01.2017,14:19,"6,32","6,28","6,36","0,64%"
Türk bankaları için bu dönem kritik!,"Türkiye bankalarının 2017'de vadesi dolacak kredilerinin yaklaşık yüzde 40'ının vadesi 2. çeyrekte, 2017'de vadesi dolan kredilerin yüzde 80'inin ise fiyatlaması 100 baz puanın altında bulunuyor",18.01.2017,13:39,"6,32","6,28","6,36","0,64%"
İşte Akbank'ın 2017 beklentileri,Akbank 2017 yılına ilişkin beklentilerini açıkladı,11.01.2017,10:07,"5,95","5,96","5,99","-0,67%"
KOSGEB kredisine 20 kat talep,Ziraat Bankası ve Denizbank tarafından kullandırılan 'Nefes Kredisi'ne 20 kat talep geldi,09.01.2017,11:23,"6,14","6,09","6,19","0,16%"
KOBİ'lere 3 destekten yararlanma şansı,"KOSGEB Başkanı Biçer, yeni yılla birlikte kota sınırını kaldırdıklarını KOBİ’lerin aynı anda 3’ten fazla destek programından faydalanabileceğini bildirdi",09.01.2017,06:32,"6,14","6,09","6,19","0,16%"
Yabancı yatırımcı borsada en çok hangi hisseyi aldı,"FETÖ’nün darbe girişimi, terör saldırıları ve dolar kumpasına rağmen yabancı Türkiye’den çıkmadı. Borsada 2016’da 629 milyon dolar, son 5 yılda ise 5.2 milyar dolarlık yabancı alımı yapıldı",07.01.2017,08:44,,,,
Akbank'tan vergi açıklaması,"Akbank, düzenlenen Vergi İnceleme Raporu hakkında açıklama yaptı
",05.01.2017,18:13,"6,01","6,06","6,09","0,00%"
Borsada değeri artan o bankalar!,"2015 sonunda 329 milyar lira olan Borsa İstanbul'un en değerli 20 şirketinin piyasa değeri, 2016'da 372 milyar liraya yükseldi",03.01.2017,12:13,"6,10","6,23","6,28","-2,09%"
Karşılıksız çek dönemi kapandı,1 ocak itibariyle artık klasik çekler tarih oldu. Karekod hakkında tüm merak edilenlerin yanıtı bu haberde...,02.01.2017,13:17,"6,23","6,24","6,27","-0,64%"
CEF’ten 2016 yılı değerlendirmesi ve 2017’ye bakış ,Akbank’ın desteğiyle Sabancı Üniversitesi’nin bünyesinde kurulan Finansal Mükemmeliyet Merkezi (Center of Excellence in Finance - CEF)“2016 Yılı Ekonomisini Değerlendirme ve 2017 Yılına Detaylı Bakış” başlıklı panel düzenledi.,28.12.2016,17:18,"6,24","6,15","6,24","1,46%"
