title,content,date,time,Şimdi,Açılış,Yüksek,Fark %
Borsa'nın 'açığa satış' tedbirine uzman yorumu,"Borsa İstanbul yönetimi, yoğun haber akışı ve spekülatif işlemlerin yatırımcılara olumsuz etkisini sınırlamak amacıyla büyük banka hisselerinde açığa satış yapmayı yasakladı. Gedik Yatırım Menkul Değerler Yatırım Danışmanlığı Müdürü Doğan, ""Alınan karar ile yatırımcıların hisseleri üzerinde ekstra bir satış baskısı oluşturmasının önüne geçilmek amaçlanıyor"" dedi.",16.10.2019,11:14,"6,78","6,48","6,78","0,44%"
Piyasalar bu verileri takip edecek,"Küresel piyasalar pozitif seyrederken, bugün yoğun veri gündemi ve ABD'de açıklanmaya başlayan şirket bilançoları takip edilecek.",16.10.2019,09:46,"6,78","6,48","6,78","0,44%"
Borsa İstanbul 7 banka için 'açığa satışı' yasakladı,"Borsa İstanbul AŞ, BIST 30 Endeksi dahilindeki banka hisselerinde bugünden itibaren geçici olarak açığa satışın yasaklandığını bildirdi.",16.10.2019,08:59,"6,78","6,48","6,78","0,44%"
FED/DALY: TİCARET VE KÜRESEL BÜYÜME RİSK TEŞKİL ETMEYE DEVAM EDİYOR,,16.10.2019,08:26,"6,78","6,48","6,78","0,44%"
Akbank borçlanma aracı ihracı için yetki verdi,"Akbank, yurt içinde 30 milyar TL'ye kadar borçlanma aracı ihracı için genel müdürlüğe yetki verdi.",10.10.2019,11:49,"7,29","7,49","7,51","-2,41%"
Bankacılık sektörü gelecek yıldan umutlu,"Bankacılık ve finans dünyasının önde gelen isimleri, gelecek yıl için bankacılıkta olumlu bir hava eseceğini ifade ederken; iştahın güçlü olduğu konusunda ortak paydada buluştu.",09.10.2019,17:25,"7,47","7,76","7,84","-3,49%"
Binbaşgil: Bankaların gücü volatiliteye rağmen iyi,"Akbank Genel Müdürü Binbaşgil, ""Bankaların gücü volatiliteye rağmen iyi, sermaye yeterlilik rasyosu (SYR) güçlü, likidite açısından iyi noktadayız, dış borçlanmada da kapılar açık"" değerlendirmesinde bulundu.",09.10.2019,11:59,"7,47","7,76","7,84","-3,49%"
Akbank sendikasyon kredisi sağladı,"Akbank uluslararası piyasalardan 810 milyon dolar karşılığı sendikasyon sağladı, yenileme oranı yüzde 83 oldu.",08.10.2019,09:41,"7,74","7,66","7,84","0,26%"
Bu hafta hangi yatırım aracı kazandırdı?,"Bu hafta, yatırım araçlarından borsa kazandırırken, altın ve döviz kaybettirdi.",29.09.2019,14:31,,,,
"TÜREB ve bankalar, EPDK'da rüzgar yatırımlarını değerlendirdi","TÜREB üyeleriyle 7 bankanın temsilcileri, rüzgar sektöründeki son gelişmeleri değerlendirmek üzere EPDK'da düzenlenen toplantıda bir araya geldi.",24.09.2019,16:12,"7,61","7,53","7,65","3,40%"
Borsada olumlu hava korunuyor,Geçen hafta piyasalarda dalgalı seyir hakimdi.,22.09.2019,10:38,,,,
Bu hafta hangi yatırım aracı kazandırdı?,"Bu hafta, yatırım araçlarından borsa kaybettirirken, altın ve döviz kazandırdı. Borsa İstanbul'da işlem gören hisse senetleri, haftayı ortalama yüzde 2,75'lik kayıpla kapattı.",21.09.2019,14:11,,,,
"Bankalar, Türk Telekom paylarının satışı için Morgan Stanley'i yetkilendirdi","Akbank, Türkiye İş Bankası ve Garanti BBVA'dan yapılan açıklamalarda satış ile ilgili gerekli çalışmaların ve potansiyel yatırımcılarla görüşmelerin başlatılacağı duyuruldu.",20.09.2019,08:42,"7,36","7,46","7,50","-0,41%"
Akbank konut kredisi faizini düşürdü,"Akbank konut kredisi faizini yüzde 1,17'ye indirdi.",17.09.2019,17:14,"7,48","7,50","7,53","-0,27%"
Bu hafta hangi yatırım aracı kazandırdı?,"Bu hafta, yatırım araçlarından borsa kazandırdı, altın ve döviz kaybettirdi. Borsa İstanbul'da işlem gören hisse senetleri, haftalık bazda ortalama yüzde 4,13 artış kaydetti.",15.09.2019,08:26,,,,
Bu hafta hangi yatırım aracı kazandırdı?,"Bu hafta, yatırım araçlarından borsa kazandırdı, altın ve döviz kaybettirdi.",07.09.2019,11:42,,,,
Borsadaki şirketlerin karı 37.7 milyar liraya geriledi,"Borsa İstanbul'da BIST 100 endeksi altında işlem gören şirketlerin net karı, ilk yarıda geçen yılın aynı dönemine göre yüzde 11,6 azalarak 37 milyar 70 milyon liraya geriledi.",04.09.2019,11:38,"7,31","7,35","7,40","0,55%"
Akbank konut kredisi faiz oranını düşürdü,Kamu bankalarının ardından özel bankalar da konut kredisi faizinde indirime gitmeye başladı. Akbank konut kredisi faizini miktar sınırı olmaksızın yüzde 1.35'e indirdi.,27.08.2019,14:42,"6,84","6,95","6,99","-1,16%"
Bu hafta hangi yatırım aracı kazandırdı?,"Bu hafta, yatırım araçlarından borsa ve döviz kaybettirirken, altın kazandırdı. Borsa İstanbul'da işlem gören hisse senetleri, haftayı ortalama yüzde 0,28'lik kayıpla kapattı.",10.08.2019,12:47,,,,
Akbank'ın ikinci çeyrek kârı geriledi,Akbank'ın net kârı ikinci çeyrekte yüzde 20.2 düşüşle 1.3 milyar TL oldu.,26.07.2019,08:30,"7,58","7,53","7,66","1,07%"
Akbank konut kredisi faizlerini düşürdü,Akbank ev almak isteyenlere ilişkin olarak konut kredisi faizini 5 yıldan 10 yıl vadeye kadar yüzde 1.49'a kadar indirdi.,24.07.2019,14:22,"7,66","7,72","7,72","-0,52%"
Borsa İstanbul'da hedef 106 bin,"Borsa İstanbul'da BIST 100 endeksi, geçen hafta yaklaşık yüzde 5 değer kazanarak 101 bin 849 puanla 18 haftanın en yüksek haftalık kapanışını gerçekleştirirken, analistler 100 bin üzerinde kalıcılık sağlanması durumunda yeni hedefin 106 bin seviyesi olacağını kaydetti.",22.07.2019,12:18,"7,53","7,53","7,61","-0,26%"
İhracatçı şirketler kur riskini masaya yatırdı,"TİM, TSPB ve üyelerinin iş birliği çerçevesinde düzenlenen ""İhracat Yapan Şirketler İçin Kur Riski Yönetimi"" konulu panel Bursa'da gerçekleştirildi.",27.06.2019,17:23,"6,68","6,76","6,82","-0,60%"
KOBİ ve işletmelere 25 milyar TL'lik destek paketi verilecek,Hazine ve Maliye Bakanlığı'nın garantisi ve 12 bankanın katılımı ile 25 milyar liralık destek devreye alınıyor. KOBİ'lere 5-50 milyon lira arasında kredi kullandırılacak. 6 ay geri ödemesiz TÜFE endeksli olacak.,12.06.2019,14:06,"6,31","6,41","6,44","-1,71%"
Türkiye’nin en değerlisi THY,"Brand Finance’in araştırmasına göre Türk Hava Yolları, 1.7 milyar doları aşan marka değeriyle geçen yıl olduğu gibi bu yıl da Türkiye’nin en değerli markası oldu.",12.06.2019,09:47,"6,31","6,41","6,44","-1,71%"
KGF'den KOBİ'lere yeni destek paketi,"Kredi Garanti Fonunun öz kaynaklarından sağladığı destekle oluşturulan ve KOBİ'lere 500 bin liraya kadar kredi imkanı sağlayan ""KGF Destek Kredisi Projesi"" bugün itibarıyla uygulamaya konuldu.",27.05.2019,15:47,"5,65","5,75","5,84","-1,05%"
Bu hafta hangi yatırım aracı kazandırdı?,"Bu hafta, yatırım araçlarından borsa kaybettirirken, altın ve döviz kazandırdı. Borsa İstanbul'da işlem gören hisse senetleri, haftayı ortalama yüzde 0,83'lık kayıpla kapattı.",25.05.2019,12:00,,,,
Borsadaki şirketlerin ilk çeyrek karı belli oldu,"Borsa İstanbul'da BIST 100 endeksi altında işlem gören şirketlerin net karı, bu yılın ilk çeyreğinde 15 milyar 597,7 milyon lira oldu.",24.05.2019,11:13,"5,71","5,59","5,80","2,88%"
Borsadaki bankaların kârı açıklandı,"Borsa İstanbul'da işlem gören 10 mevduat bankasının net kârı, bu yılın ilk çeyreğinde 2018'in aynı dönemine göre yüzde 19,9 azalarak 7 milyar 844 milyon lira olurken, ortalama özkaynak karlılığı yüzde 12,7 seviyesinde gerçekleşti.",17.05.2019,11:15,"5,78","5,73","5,89","0,17%"
Arkas Holding 800 milyon dolar sendikasyon kredisi aldı,"Arkas Holding, 800 milyon dolar refinansman kredisi için 18 banka ile anlaştı.",15.05.2019,11:43,"5,74","5,71","5,79","0,53%"
TSPB'nin yeni başkanı Alp Keler oldu,"Türkiye Sermaye Piyasaları Birliği'nin (TSPB) yeni başkanı Alp Keler olurken; Keler, ""Belirlenen yol haritasındaki hedeflerin gerçekleştirilmesi ve sektörün en etkin şekilde temsil edilmesi için çalışacağız"" şeklinde açıkladı.",14.05.2019,16:51,"5,71","5,54","5,79","4,01%"
3 büyük şirketten kar açıklaması,"Erdemir'in ilk çeyrekte net karı yüzde 6.3, Akbank'ın ilk çeyrekte net karı yüzde 17.4 azalırken; Şişecam'ın net karı ilk çeyrekte yüzde 14 arttı.",29.04.2019,09:16,"6,05","6,23","6,24","-2,58%"
Borsada en çok bu hisseler kazandırdı,"BIST 100 endeksinin şampiyonları yüzde 34,37 primle Galatasaray Sportif ve yüzde 23,65'lik artışla Beşiktaş Futbol oldu.",28.04.2019,00:59,,,,
"""Turizm sektörüne de çok önemli yatırımlarımız var""","Akbank Perakende Bankacılık Genel Müdür Yardımcısı Oğuz, ""Tüm sektörlere olduğu gibi, turizm sektörüne de çok önemli yatırımlarımız var. Turizm, Türkiye'nin ihracatla birlikte en yüksek döviz kazandırıcı faaliyet gösteren sektörlerin başında geliyor"" dedi.",19.04.2019,11:44,"6,24","6,34","6,37","-1,11%"
KOBİ'lere 3 milyar liralık yeni destek,"Kredi Garanti Fonunca sağlanacak kefalet desteğiyle ""İşletmelerin ve KOBİ’lerin Rekabet Edebilirliği Programı"" (COSME) kapsamında KOBİ'lere 3 milyar lira tutarında kredi kullandırılabilecek.",11.04.2019,15:25,"6,20","6,29","6,42","-1,12%"
İhracatçıların kur riski İstanbul'da ele alınacak,"""İhracat Yapan Şirketler İçin Kur Riski Yönetimi"" başlıklı panellerin ilki 8 Nisan'da İstanbul'da düzenlenecek.",02.04.2019,11:29,"6,00","6,08","6,29","-2,28%"
Akbank sendikasyon kredisi sağladı,Akbank uluslararası piyasalardan 700 milyon dolar karşılığı iki dilimli sendikasyon kredisi sağladı.,27.03.2019,10:37,"5,53","6,06","6,08","-8,14%"
Uludağ Ekonomi Zirvesi 22 Mart'ta başlayacak,"Bursa'da bu yıl 8'incisi düzenlenecek ""Uludağ Ekonomi Zirvesi"", 22-23 Mart'ta çeşitli ülkelerden iş ve siyaset dünyasının önemli isimlerini buluşturacak.",16.03.2019,13:51,,,,
Borsadaki şirketlerin karı 90 milyar liraya dayandı,"Borsa İstanbul'da BIST 100 endeksi altında işlem gören şirketlerin net karı, geçen yıl 2017 sonuna göre yüzde 15 artarak 90 milyar liraya dayanırken, en fazla net karı elde eden İş Bankası zirveye yerleşti.",16.03.2019,11:17,,,,
Borsadaki bankaların aktif büyüklüğü 2.5 trilyon lirayı aştı,"Borsa İstanbul'da işlem gören 10 mevduat bankasının aktif büyüklüğü, 2018 yıl sonunda 2,5 trilyon lirayı aştı.",02.03.2019,13:09,,,,
Türkiye Bankalar Birliği duyurdu: 17 bankamız iştirak etti,"Türkiye Bankalar Birliği, KOBİ Değer Kredisi 2'ye 17 bankanın iştirak ettiğini açıkladı. KOBİ Değer Kredisi 2 25 milyar lira tutarında destek sağlayacak.",01.03.2019,11:04,"6,65","6,90","6,91","-3,20%"
Akbank sendikasyon kredilerini yeniliyor,Akbank vadesi Mart ayında dolacak yaklaşık 600 milyon dolar tutarında sendikasyon kredilerini yeniliyor.,08.02.2019,15:09,"6,73","6,77","6,86","-1,03%"
Yabancıdan 2 yılın en güçlü alımı! En çok bu hisse tercih edildi,"Borsa İstanbul'da yabancı yatırımcılar, 2019'un ilk ayında 798 milyon dolarla son 2 yılın en güçlü net alımını gerçekleştirdi. Akbank, 104 milyon dolarla ocakta yabancı yatırımcıların en fazla tercih ettiği hisse senedi oldu.",06.02.2019,13:03,"6,78","7,00","7,02","-2,59%"
Dünyanın en değerli bankası belli oldu,"Brand Finance'ın araştırmasına göre, dünyanın en değerli 500 banka markası sıralamasında zirvede 79,8 milyar dolarlık değeriyle Çinli ICBC yer aldı.",04.02.2019,11:13,"6,84","6,91","6,94","-0,58%"
En çok hangi yatırım aracı kazandırdı?,"Bu hafta, borsa ve altın yatırımcısına kazandırırken, döviz kaybettirdi. Borsa İstanbul'da işlem gören hisse senetleri, haftayı ortalama yüzde 1,12'lik kazançla kapattı.",02.02.2019,13:03,,,,
İşte Borsa İstanbul şirketlerinin son çeyrek kar beklentileri,"Borsa İstanbul’da hisseleri işlem gören banka dışı şirketlerin konsolide olmayan bilançoları için son tarih 1 Mart Cuma günü iken, konsolide bilançolar için ise 11 Mart Pazartesi son gün olarak belirlenmiştir.",28.01.2019,16:46,"6,49","6,51","6,68","-0,15%"
Piyasalara yabancı morali...,"Yabancılar 2013’ten bu yana en yüksek hisse senedi alımını gerçekleştirdi. 18 Ocak haftasında 711 milyon dolarlık hisse senedi alımı yapan yabancılar, tahvil bonoda 121 milyon dolarlık satış gerçekleştirdi. Son iki haftada ise hisse senetlerinde yapılan alım 826 milyon doları buldu.",27.01.2019,13:09,,,,
Akbank'tan bedelli sermaye artırımı açıklaması,"Akbank 3 milyar TL tutarındaki bedelli sermaye artışına katılımın yüzde 99.9 olduğunu duyururken, geri kalan az sayıdaki hisse 22-23 Ocak tarihlerinde Borsa İstanbul'da halka arz edilecek.",18.01.2019,15:15,"6,55","6,64","6,77","-0,91%"
Borsa İstanbul'da böylesi 2 yıldır görülmedi! İşte beklenti,"Borsa İstanbul 100 endeksi, 4 Ocak'ta başlayan ve dünkü kapanışa kadar devam eden 10 günlük ralli ile 2016 yılından bu yana aralıksız en uzun soluklu çıkışını yaptı. Tarihinde sadece 11 kez gerçekleşen böyle bir ralli, en son 2016'da gerçekleşmişti. Endeks kapanışları itibarıyla en uzun soluklu yükseliş rekoru da 11 gün ile 2016 ve 2012'de görülmüştü.",18.01.2019,12:45,"6,55","6,64","6,77","-0,91%"
Akbank 2019 beklentilerini açıkladı,"Akbank, bu yıl kredi ve mevduatta yüzde 10'a yakın büyüme, yüzde 12 üzeri özsermaye kârlılığı bekliyor.",09.01.2019,09:17,"5,70","5,89","5,89","-2,40%"
AKBANK: BANKAMIZDA ÖZELLİKLİ KREDİLER İŞ BİRİMİ KURULMUŞTUR,,04.01.2019,15:14,"5,84","5,59","5,91","5,80%"
Bireysel yatırımcıya dövizle tahvil ihracı devam edecek,"Hazine, Euro ve dolar cinsi devlet tahvili ihraçlarına yatırımcı talebi üzerine devam edileceğini duyurdu. Talepler 7 Ocak–1 Şubat arasında toplanacak.",04.01.2019,08:34,"5,84","5,59","5,91","5,80%"
Akbank'tan bedelli sermaye artırımı açıklaması,Akbank'ın yüzde 30 bedelli sermaye artışında yeni pay alma hakkı 1 TL nominal pay için 2.5 TL nominal olarak kullandırılacak.,31.12.2018,13:42,"5,88","5,87","5,89","0,17%"
5.7 milyon çalışanın BES’e girişi ertelendi,"Hazine ve Maliye Bakanlığı, BES’e otomatik katılım uygulamasında değişiklik yaptı. 2019’un nisan ayında işverenleri tarafından yeniden sisteme alınması gereken 5.7 milyon kişinin girişleri 2020’ye ertelendi. 2019’un ocak ayında sisteme girecek 5-9 çalışanı olan işletmelerdeki 2 milyon kişiye, özel sandıklardaki 150 bin çalışan da eklendi.",28.12.2018,09:35,"5,87","5,88","5,93","0,17%"
Akbank'ın sermaye artırımına onay,Akbank'ın bedelli sermaye artırımına ilişkin izahnamesi ve 2 milyar dolara kadar borçlanma aracı ihracı başvurusu SPK tarafından onaylandı.,28.12.2018,08:52,"5,87","5,88","5,93","0,17%"
Akbank kredi alacaklarını sattı,Akbank takipteki kredi alacaklarının 446 milyon TL'lik kısmını 19.4 milyon TL bedelle sattı.,27.12.2018,09:36,"5,86","5,92","5,94","0,51%"
Başarılı bir dengelenme sürecine girdik,2018’in son haftasının ilk gününde Akbank Genel Müdürü Hakan Binbaşgil’le sohbet ettik. Söze şu cümleyle girdi:,25.12.2018,09:59,"5,78","5,81","5,81","-1,03%"
Binbaşgil: 2019 daha iyi bir yıl olacak,"Akbank Genel Müdürü Binbaşgil, ""Bankacılık sektöründe 2019 kredi büyümesi açısından daha iyi olacak"" açıklamasında bulundu.",24.12.2018,12:44,"5,84","5,94","5,96","-1,02%"
"‘Yandık, bittik’ demek yok yeni bir Türkiye hikâyesi yazalım","Sabancı Holding CEO’su Mehmet Göçmen, göreve geldiği günden itibaren şu tavrını grup bünyesindeki şirketlerin yöneticilerine yansıttı:",21.12.2018,16:50,"5,90","5,82","5,95","1,37%"
Yatırımcıların gözü altın ve döviz tahvili ihracında,"Hazine ve Maliye Bakanlığı tarafından, belirlenen bankalar aracılığıyla yarından itibaren altın tahvili ve altına dayalı kira sertifikası talep toplama işlemleriyle euro ve dolar cinsinden devlet tahvili ihracına başlanacak.",16.12.2018,13:23,,,,
2019'un piyasa yapıcı bankaları belirlendi,"Hazine ve Maliye Bakanlığı tarafından, 2019'da 12 bankanın piyasa yapıcı olarak faaliyet göstermesi uygun görüldü.",14.12.2018,17:50,"5,45","5,48","5,51","-1,09%"
Bireysel yatırımcıya Euro ve dolar cinsi tahvil ihracı! İşte detaylar,Hazine 17-21 Aralık arasında euro ve dolar cinsi devlet tahvili ihracı gerçekleştirecek.,13.12.2018,10:06,"5,51","5,53","5,61","-0,18%"
"AKBANK SERMAYESİNİ 4 MİLYAR TL'DEN 5,2 MİLYAR TL'YE ÇIKARACAK",,05.12.2018,09:04,"6,00","5,88","6,08","-4,61%"
"9 ayda 65,2 milyar liralık net kar","Borsa İstanbul'da BIST 100 endeksi altında işlem gören şirketlerin net karı, 9 ayda geçen yılın aynı dönemine göre yüzde 13,9 artarak 65 milyar lirayı aşarken, en fazla net karı Garanti Bankası elde etti.",25.11.2018,10:13,,,,
Akbank'tan borçlanma aracı ihracı kararı,Akbank yurtdışında 2 milyar dolara kadar borçlanma aracı ihracı kararı aldı.,06.11.2018,17:42,"6,25","6,37","6,39","-1,57%"
Akbank'ın kârı geriledi,Akbank'ın üçüncü çeyrek solo net kârı yüzde 11 civarı düşüşle 1.33 milyar TL olarak açıklandı.,25.10.2018,09:35,"5,80","5,77","5,80","-0,68%"
Bu hafta en çok hangi yatırım aracı kazandırdı?,"Borsa İstanbul'da işlem gören hisse senetleri, haftalık bazda ortalama yüzde 5,08 azalış kaydetti. Bu hafta 24 ayar külçe altının gram satış fiyatı yüzde 3,18, dolar/TL yüzde 1,74 ve euro/TL yüzde 1,28 değer kazandı.",06.10.2018,14:33,,,,
AKBANK GM BİNBAŞGİL: SENDİKASYONU YÜZDE 104 İLE YENİLEDİK,,27.09.2018,15:03,"5,95","5,70","6,02","4,57%"
Türk Eximbank yatırımcılar ile görüşecek,Türk Eximbank bu hafta Londra'da kurumsal yatırımcılar ile toplantı gerçekleştirecek.,24.09.2018,09:42,"5,80","5,46","5,80","6,42%"
Borsadaki şirketlerin karı 24 milyar liraya dayandı ,"Borsa İstanbul'da BIST 100 endeksi altında işlem gören şirketlerin net karı, bu yılın 2. çeyreğinde 23 milyar 936 milyon lira oldu.",31.08.2018,11:16,"4,94","5,11","5,14","-3,33%"
Türk Telekom'un yüzde 55'lik hissesi için önemli gelişme,"Türk Telekom'un OTAŞ'ta bulunan yüzde 55'lik hissesi Akbank, Garanti Bankası ve İş Bankası'na geçiyor. Bankalar, OTAŞ'ın kredi borçlarını ödememesi üzerine Rekabet Kurumu'na başvurmuştu.",29.08.2018,09:30,"5,11","5,15","5,21","-1,92%"
Borsadaki bankaların kârı yüzde 13 arttı,"Borsada işlem gören 10 mevduat bankasının net kârı, bu yılın ilk yarısında 2017'nin aynı dönemine göre yüzde 13,3 artarak 19 milyar 584 milyon lira oldu.",27.08.2018,12:39,"5,05","5,12","5,14","-0,98%"
Türk Telekom için izin çıktı,"Bilgi Teknolojileri ve İletişim Kurumu, OTAŞ'ın Türk Telekom'daki yüzde 55 hissesinin OTAŞ'a kredi veren bankaların paydaş olacağı SPV'ye devrine izin verdi.",17.08.2018,09:08,"4,99","4,77","4,99","3,53%"
"""Panik yaşanmadı, bankalarımız hazırlıklı""","Akbank Genel Müdürü Binbaşgil, ""Piyasalardaki hareketliliğin önlenmesi konusunda bir seri önemli aksiyonlar alındı, bunların sonuçlarını görmeye başladık"" dedi.",15.08.2018,15:47,"4,99","5,43","5,46","-5,67%"
Bakan Albayrak yeni ekonomi modelini açıkladı,"Hazine ve Maliye Bakanı Berat Albayrak, Yeni Ekonomi Modeli'ni Dolmabahçe Sarayı'nda düzenlediği toplantıda açıkladı. 'Yeni Ekonomi Modeli'nin açıklandığı toplantıya İstanbul Sanayi Odası ve İstanbul Ticaret Odası başta olmak üzere birçok oda ve birlik başkanı, banka genel müdürleri, sektör temsilcileri ve aralarında önde gelen holdinglerin yönetim kurulu başkanları da katılım sağladı.",10.08.2018,15:31,"5,76","5,99","6,08","-5,73%"
Türk bankaları için 'AL' tavsiyesi,"VTB Capital, raporunda Türk bankalarına ilişkin tavsiyesini 'AL' olarak güncelledi.",26.07.2018,13:23,"6,02","6,07","6,21","-0,33%"
Akbank'ın kârı beklentilerin üzerinde geldi,Akbank'ın ikinci çeyrek net kârı beklentilerin hafif üzerinde 1.6 milyar TL oldu.,26.07.2018,09:18,"6,02","6,07","6,21","-0,33%"
Türk Telekom bankalara geçiyor,"Akbank, Garanti Bankası ve İş Bankası Ojer Telekomunikasyon'a ait Türk Telekom'un yüzde 55 hissesini devralmak için Rekabet Kurumu'na başvuruda bulundu.",05.07.2018,15:09,"6,54","6,47","6,55","1,71%"
Ünlü yatırımcı: Türk Lirası alın,"Ünlü yatırımcı Mobius, ""Türk Lirası ucuz, Türk Lirası varlıkları alınabilir, yatırım yapılabilir"" tavsiyesinde bulundu.",26.06.2018,10:05,"6,22","6,08","6,22","2,64%"
Borsada bu seviyeler yatırımcı için fırsat mı?,"Dolar bazında 2009 yılından bu yana gördüğü en düşük seviyelere gerileyen hisse senedi fiyatları, uzun vadeli düşünen ve biriktirme amaçlı portföy oluşturan yatırımcılar için alım fırsatı sunuyor.",21.06.2018,11:43,"6,22","6,23","6,28","-0,32%"
Türkiye'nin en değerli markası belli oldu,"Brand Finance'in yaptığı araştırmaya göre, 2 milyar doları aşan değeriyle ""Türkiye'nin en değerli markası"" Türk Hava Yolları oldu.",05.06.2018,11:50,"6,49","6,69","6,73","-2,41%"
SPK'dan pay alım esaslarında düzenleme! Türk Telekom için uygulanabilir mi?,"Sermaye Piyasası Kurulu (SPK), pay alım teklifi tebliği kapsamında halka açık ortaklıklarda gönüllü ve zorunlu pay alım muafiyeti esaslarında düzenleme yaparken, düzenlemenin Türk Telekom'un ana hissedarı OTAŞ'a sağlanan kredi ile ilgili çözüm sürecinde uygulanabileceği belirtiliyor.",05.06.2018,09:07,"6,49","6,69","6,73","-2,41%"
Bankalar Türk Telekom’da devrede,"TÜRK Telekom’da, Otaş’a ait hisseler için formül bulundu.",22.05.2018,11:07,"7,33","7,30","7,45","0,83%"
Sabancı Holding ilk çeyrek kârını açıkladı,"Sabancı Holding’in konsolide satışları, 2018 yılının ilk üç ayında bir önceki yılın aynı dönemine göre yüzde 24 artarak 11 Milyar 322 Milyon TL oldu. Sabancı Holding konsolide ana ortaklık net karı ise, 2018 yılının ilk üç ayında bir önceki yılın aynı dönemine göre yüzde 59 artarak 1 Milyar 66 Milyon TL olarak gerçekleşti.",08.05.2018,08:49,"7,01","7,09","7,10","-0,28%"
Devlerden kâr açıklaması!,"Türk Telekom ilk çeyrek net kârı kur zararının etkisiyle 56 milyon TL olurken, Akbank'ın net kârı ilk çeyrekte yüzde 18 artarak 1.7 milyar lira oldu.",26.04.2018,08:47,"7,51","7,74","7,76","-2,34%"
Hürriyet Yazarı Uğur Gürses’e büyük ödül,Türkiye Sermaye Piyasaları Birliği (TSPB) 3. TSPB Sermaye Piyasaları Ödül Töreni’ni kapsamında Sermaye Piyasası Yazarı ödülünü Hürriyet Yazarı Uğur Gürses’e verdi.,12.04.2018,09:50,"7,90","7,70","7,92","2,46%"
Çanakkale Köprüsü için finansman sağlandı,Çanakkale köprüsü ve otoyolu projesi için ağırlıklı yabancılardan oluşan 24 banka ve finans kuruluşundan 2.3 milyar euro tutarında kredi finansmanı sağlandı.,16.03.2018,15:46,"8,32","8,42","8,42","-0,48%"
İşte borsadaki şirketlerin 2017 kârı!,"Borsa İstanbul'da BIST 100 endeksi altında işlem gören şirketlerin net karı, geçen yıl 74 milyar 50,8 milyon lira oldu.",16.03.2018,11:37,"8,32","8,42","8,42","-0,48%"
Bu hafta hangi yatırım aracı kazandırdı?,"Bu hafta altın ve döviz yatırımcısına kaybettirirken borsa yatay seyretti. Borsa İstanbul'da işlem gören hisse senetleri, haftayı ortalama yüzde 0,05'lik sınırlı kazançla kapattı.",10.03.2018,12:05,,,,
"""Sabancı olarak Türkiye’nin iki katı büyümeyi hedefliyoruz”","Sabancı Holding 2017 yılı finansal sonuçlarını açıkladı. Buna göre 2017 yılı kombine net satışları yüzde 22 artışla 65 Milyar 600 Milyon TL, konsolide net karı ise yüzde 31 artışla 3 Milyar 481 Milyon TL olarak gerçekleşti. Kombine EBITDA ise, yüzde 34 artışla 15 Milyar TL oldu.",26.02.2018,15:10,"8,74","8,73","8,79","0,92%"
Çalışan başına kar rekoru Akbank'ın ,"Türkiye'de aktif toplamı en yüksek olan ilk 10 bankanın konsolide olmayan mali tablolarına göre, çalışan başına düşen net kar tutarları hesaplandığında, Akbank yaklaşık 435 bin lira ile zirvedeki yerini korudu.",23.02.2018,13:23,"8,66","8,69","8,76","0,23%"
Dünyanın en değerli bankası belli oldu,"Brand Finance araştırmasına göre, Çinli ICBC, 59,2 milyar dolarlık marka değeriyle dünyanın en değerli banka markası oldu.",07.02.2018,12:03,"8,55","8,68","8,70","-0,93%"
"Yapı Kredi şube kapattı, Garanti eleman azalttı","2017 yılında 70 şubeyle en fazla şube kapatan banka Yapı Kredi Bankası olurken, Garanti Bankası ise 895 kişiyle yollarını ayırdı. ",02.02.2018,10:59,"8,76","8,73","8,83","0,69%"
Akbank'tan 6 milyar net kâr,"Akbank'ın 2017 yılında konsolide net karı, 6 milyar 20 milyon lira oldu.",01.02.2018,09:24,"8,70","9,02","9,04","-3,12%"
Türk Telekom’da bankalar dönemi,"Türk Telekom’un yüzde 55’ine sahip Otaş’a kredi veren ve geri alamayan en büyük üç bankanın Ulaştırma Bakanlığı ile anlaştığı ve sürecin hukukileştirilmesine karar verildiği öğrenildi. Bankaların nihai amacının Otaş’ın iflasını isteyerek ya da anlaşarak sahibi olmak, bu yolla alacaklarını tahsil etmek olduğu görülüyor.",23.01.2018,10:00,"8,50","8,47","8,55","1,07%"
Odeabank’a atanamayan müdür olayının perde arkası,"Ankara kulislerini bana sorun. Neler var neler. “İstanbul finans merkezi olacak”, “Bankacılık sistemimiz güçlü” nidaları içinde olan yüksek bürokratlarca yönetilen kurumların nasıl çalıştığına dair üzücü bir olay anlatacağım: Arkanıza yaslanın, bakın neler olmuş:",15.01.2018,16:31,"7,88","8,03","8,12","-2,23%"
3 dev Türk Telekom'u 'yakın izleme'ye aldı,"Akbank'ın ardından Garanti Bankası ve İş Bankası da OTAŞ kredisini 2017 sonu itibarıyla ""yakın izlemedeki krediler"" sınıfına aldı.",11.01.2018,13:40,"7,97","7,96","7,99","0,63%"
